page_url,drug_name,price,description,rating,num_of_reviews
www.proficosmetics.ru/catalog/70764/,Крем-люкс с экстрактом черной икры против морщин / Luxury Anti-Wrinkle Cream 50 мл,13200,"Крем-люкс против морщин с экстрактом черной икры Luxury Anti-Wrinkle Cream Declare совершенствует ежедневный уход за кожей, доставляя приятное ощущение роскоши и комфорта. Уникальная формула на основе дрожжевых экстрактов обеспечивает поразительный эффект разглаживания морщин. Витамин Е и сахариды...                             ",No rating,No reviews
www.proficosmetics.ru/catalog/26694/,Крем дневной для лица / IMMUN 50 мл,3835,"Легкий крем оптимально увлажняет и защищает кожу от агрессивного воздействия внешней среды, является прекрасной основой под макияж. Идеально подходит для сухой и чувствительной кожи. Усиливает систему самозащиты раздраженной кожи, предотвращает процесс преждевременного старения.                             ",5.0,1
www.proficosmetics.ru/catalog/54612/,Крем-филлер моделирующий для губ / EYE CONTOUR & LIP FORMULA 10 мл,4698,HISTOMER представляет Моделирующий крем-филлер для губ - естественную альтернативу инъекциям гиалуроновой кислоты и коллагена. В основе формулы лежит инновация - Пролабиальная Гиалуроновая Кислота - специальный тип гиалуроновой кислоты с низкомолекулярным весом и высокой проникающей способностью....                             ,5.0,3
www.proficosmetics.ru/catalog/113580/,Крем питательный Collagen-Bio 50 мл,1670,"Идеальное средство ежедневного ухода для тех, кому необходимы интенсивное питание, увлажнение и омоложение кожи. Гиалуроновая кислота - компонент активной гидратации, удерживает влагу в клетке и межклеточном пространстве. Морской коллаген стимулирует коллагеновый каркас кожи и создает...                             ",No rating,No reviews
www.proficosmetics.ru/catalog/84241/,Крем гидроуспокаивающий / Hydra Calming Cream 50 мл,3690,"Успокаивающий, увлажняющий крем для лица для чувствительной и раздраженной кожи. Тщательно подобранный ингредиентный состав средства обеспечивает ""грамотный"", значимый и бережный уход. Увлажняет, снимает покраснения, раздражения и дискомфорт. Препарат восстанавливает и укрепляет защитные...                             ",4.67,13
www.proficosmetics.ru/catalog/105286/,Крем массажный ревитализирующий для лица / Revitalizing Facial Massage Cream 250 мл,5017,"Крем массажный для лица 200 мл Назначение: для массажа лица, шеи и зоны декольте. Активные ингредиенты: экстракт клеток меристем корня дуба и бука черешчатого (Хистомерные клетки), гидролизированные протеины растений (сои, кукурузы, пшеницы), экстракт листьев зеленого чая, бисабол. Способ...                             ",No rating,No reviews
www.proficosmetics.ru/catalog/87415/,Крем тонизирующий дневной против покраснений и купероза SPF 15 / BIOGENA COUPEROSE 50 мл,4914,"Крем помогает решить проблему расширенных поверхностных капилляров и обширных покраснений. Защищает кожу от вредоносного воздействия солнечных лучей. С помощью рутина, витамина С и экстракта иглицы тонизирует стенки сосудов, увлажняет, питает кожу, повышает ее тургор. Результат: решение расширенных...                             ",No rating,No reviews
www.proficosmetics.ru/catalog/50845/,Крем Барбадос / Delicate Oily Skin Balm BARBADOS 250 мл,6205,"Легкий крем для чувствительной проблемной кожи. Крем на основе натурального сока алоэ, предназначенный для жирной и себорейной кожи, разработан в конце 70-х годов, принес мировую известность лаборатории Anna Lotan. Формула запатентована. Крем представляет собой легкую эмульсию типа «масло в воде» с...                             ",4.72,31
www.proficosmetics.ru/catalog/50940/,Крем-мусс успокаивающий для деликатной кожи Барбадос / Air Calming Balm BARBADOS 75 мл,2625,"Легкий воздушный увлажняющий крем-мусс разработан для оптимального ухода за чувствительной жирной кожей, склонной к покраснениям и раздражениям кожи лица и на Т-участке и щеках характерных при себорее. Идеально подходит для кожи подростков, а так же для мужчин после бритья. Крем-мусс мгновенно...                             ",4.75,4
www.proficosmetics.ru/catalog/3070903/,Крем фотоблок для жирной кожи SPF 50 / Оily Skin Sunguard (2021) 50 мл,1810,"Революционная формула превращает традиционный солнцезащитный крем в воздушную эмульсию. Обеспечивает максимальную защиту от негативного воздействия солнечных лучей спектра А и В. Средство в консистенции крем-геля равномерно наносится на кожу, быстро впитывается...                             ",5.0,2
www.proficosmetics.ru/catalog/2314637/,Крем дневной себостатический для лица / Homework 50 мл,1525,"Крем дневной себостатический для лица Homework станет союзником жирной кожи в первой половине дня Препарат, используемый в качестве основы под макияж или самостоятельно, нормализует салоотделение, станет барьером болезнетворным бактериям и УФ-лучам. Эффект от курсового применения: уменьшение...                             ",5.0,5
www.proficosmetics.ru/catalog/3070904/,Крем фотоблок для сухой кожи SPF 50 / Dry Skin Sunguard (2021) 50 мл,1905,"Революционная формула превращает традиционный солнцезащитный крем в воздушную эмульсию. Обеспечивает максимальную защиту от негативного воздействия солнечных лучей спектра А и В. Средство в консистенции крем-геля равномерно наносится на кожу, быстро впитывается...                             ",5.0,1
www.proficosmetics.ru/catalog/85791/,Крем миорелакс триактив 50 мл,970,"Крем оказывает тройное anti-age воздействие на кожу: предупреждает возникновение и сглаживает мимические и возрастные морщины, восстанавливает упругость и эластичность кожи, обеспечивает глубокое увлажнение, защищает от окислительного стресса. Активные ингредиенты: экстракты голубики, имбиря,...                             ",4.57,21
www.proficosmetics.ru/catalog/58741/,Крем восстанавливающий ночной / Restore Night Cream RECOVERY 50 мл,8560,"Крем с мягкой текстурой насыщен успокаивающими, регенерирующими, противоотечными ингредиентами. Инновационная формула крема ускоряет рост эпителиального слоя, предоотвращает образование рубцов, предоохраняет клетки от старения. Стимулирует синтез коллагена и эластиина. Без...                             ",5.0,1
www.proficosmetics.ru/catalog/157095/,Крем лифтинговый укрепляющий Морской берег 100 мл ,5720,"Крем лифтинговый укрепляющий Морской берег - дневной крем с насыщенной текстурой для регулярного ухода за кожей с признаками увядания и коррекции возрастных изменений. Способствует уменьшению глубины морщин и подтягивает кожу, восстанавливает оптимальный уровень гидратации и защищает от повреждения...                             ",No rating,No reviews
www.proficosmetics.ru/catalog/72391/,Крем-актив для упругости кожи 50 мл,990,"Действие: мультифункциональный крем ухаживает за зрелой кожей в дневное время, обладает увлажняющими, смягчающими и антивозрастными свойствами. При регулярном применении крема улучшается структура кожи, она становится гладкой, эластичной, выглядит молодой, нежной, с естественным сияющим оттенком....                             ",5.0,9
www.proficosmetics.ru/catalog/53055/,Крем дневной / Premium cellular shock 50 мл,5601,"Активный лифтинговый крем для сухой, нормальной и комбинированной кожи с выраженными возрастными изменениями. Матриксил, входящий в состав средства, является стимулятором упругости кожи, активирует фибробласты, инициируя синтез коллагенов 1-го, 4-го, 7-го типов, а также гликозаминогликанов и белка...                             ",No rating,No reviews
www.proficosmetics.ru/catalog/64008/,Крем деликатный увлажняющий / Delicate Moisturizer ALODEM 75 мл,2985,"Крем деликатный увлажняющий питает смягчает и увлажняет кожу, защищает липидный барьер. Специальные ингредиенты придают коже гладкость и шелковистость. Специальная формула крема легко впитывается. Средство рекомендовано для кожи склонной к покраснениям.                             ",5.0,12
www.proficosmetics.ru/catalog/62790/,Крем увлажняющий с гамамелисом Клир / CLEAR Hamamelis Moisturizer 70 мл,2380,"Мягкий увлажняющий крем эффективно успокаивает кожу, постепенно снимает покраснения. Специально разработан с целью снять гиперемию и раздражения/покраснения на жирной проблемной коже. Композиция на 99% состоит из ингредиентов натурального происхождения и включает в себя успокаивающие и увлажняющие...                             ",5.0,9
www.proficosmetics.ru/catalog/3115974/,Крем для лица Витамин С 50 мл,1290,"Крем на основе витамина С для активной коррекции пигментации. Совершенное средство для восстановления процесса выработки меланина. Экстракт толокнянки активизирует обменные процессы и оказывает антиоксидантное действие. Экстракт петрушки снимает раздражение, осветляет, тонизирует и питает кожу....                             ",No rating,No reviews
www.proficosmetics.ru/catalog/72382/,Крем для чувствительной кожи склонной к куперозу 50 мл,730,"Действие: крем предназначен для ухода за чувствительной кожей, склонной к куперозу, повышения ее устойчивости к внешним раздражителям. Регулярное применение крема эффективно выравнивает цвет и рельеф кожи, дарит ощущение комфорта и свежести. Рекомендуется для ухода за кожей, склонной к куперозу и...                             ",4.48,23
www.proficosmetics.ru/catalog/113925/,Крем солнцезащитный против возрастной гиперпигментации SPF 50 / BIOGENA TAE-X 50 мл,3901,"Эффективен при кератозе и пятнах гиперпигментации. Специальная формула SPF50+ (SPF80) для поддержки дерматологических курсов коррекции недостатков кожи, вызванных избыточным пребыванием на солнце (темные пятна, фотостарение и другие проявления старения кожи). В основе формулы лежит КОМПЛЕКС ЗАЩИТЫ...                             ",3.0,1
www.proficosmetics.ru/catalog/76874/,Крем для глазного контура / ECTA 40+ PREMIUM 30 мл,5640,"Активный крем для профилактики старения и коррекции уже имеющихся возрастных изменений зоны век. Благодаря входящему в состав инновационному комплексу на основе эктоина, низкомолекулярного аналога гиалуроновой кислоты (Bioami skin), матриксила и метилсиланола маннуроната, средство обеспечивает...                             ",4.75,7
www.proficosmetics.ru/catalog/72319/,Крем с коллагеном для глаз / Intencive Care 15 мл,1255,"Роскошный крем является безоперационной альтернативой блефаропластике. Инновационный комплекс Beautifeye подтягивает верхнее веко. Коллаген и гиалуроновая кислота, входящие в состав, уменьшают глубину ""гусиных лапок"" и стимулируют процессы омоложения кожи. Активные ингредиенты:...                             ",4.0,9
www.proficosmetics.ru/catalog/136686/,Крем увлажняющий с аргановым маслом / Moisturising Argan Cream 50 мл,2720,"Увлажняющий крем с бархатистой текстурой. Уникальный состав жирнокислотной фракции масел аргании и макадамии, экстрактов из почек бука, корешков свеклы, сквалена, витамина Е, катехинов и растительного резорцинола обеспечивает мультифункциональность продукта. Оказывает омолаживающее действие за счет...                             ",4.6,5
www.proficosmetics.ru/catalog/50505/,Крем восстанавливающий ночной / Beaute Globale 50 мл,1428,"Ночной крем ""Beauté Globale"" (с 20 лет) - Омолаживающий и поддерживающий уход. Крем нового поколения эффективно стабилизирует содержание влаги в клетке и межклеточном пространстве, повышает эластичность и упругость кожи, препятствует транэпидермальной потере воды, оставляет на коже...                             ",4.83,18
www.proficosmetics.ru/catalog/93980/,Крем энергетический для комбинированной и жирной кожи 50 мл,830,"Формула крема разработана с учетом особенностей жирной и комбинированной кожи, склонной к единичным воспалительным элементам. Крем эффективно корректирует сальность на жирных участках лица и поддерживает естественный водный баланс на сухих и нормальных. Крем насыщает кожу полезными минералами,...                             ",4.63,8
www.proficosmetics.ru/catalog/807160/,Крем-лифтинг с бриллиантами для лица 50 мл,1803,"Лифтинг ‐ крем с бриллиантами Crème Lifting Diamant - роскошный омолаживающий лифтинг-крем высокотехнологичное anti‐age средство, действие которого направлено на обновление и восстановление клеточной матрицы. Уникальный активный комплекс проникает в глубокие слои кожи, корректирует контур лица и...                             ",No rating,No reviews
www.proficosmetics.ru/catalog/3096960/,Крем восстанавливающий после солнца для лица и тела / Aftersun replenishing cream for face and body 150 мл,4180,"Успокаивающий восстанавливающий крем-гель, созданный специально для охлаждения и смягчения покрасневшей и загоревшей кожи. Содержит экстракт померанца миртолистного Чинотто с фермы синьора Пароди из Финале Лигуре (провинция Савона), который насыщен антиоксидантами и обладает противовоспалительным...                             ",No rating,No reviews
www.proficosmetics.ru/catalog/3109637/,"Крем-лифтинг, скульптурирование лица и шеи / YOUTH ACTIVE LIFT 50 мл",6688,"Крем-лифтинг, скульптурирование лица и шеи благодаря коктейлю из ингредиентов натурального происхождения, помогает коже становиться более упругой, эластичной и сияющей, обеспечивает видимый разглаживающий и лифтинговый эффект. Средство помогает день за днем подтягивать кожу и делать контуры лица...                             ",No rating,No reviews
www.proficosmetics.ru/catalog/75581/,Крем с коллагеном и гиалуроновой кислотой для лица / Aqua Balance 150 мл проф.,3060,"Легкая нежирная текстура крема быстро впитывается, служит прекрасной основой под макияж. Нативный коллаген и гиалуроновая кислота способствуют омоложению и разглаживанию морщин изнутри, натуральные масла оливы и персика питают, увлажняют, обеспечивают естественную защиту, пантенол способствует...                             ",5.0,3
www.proficosmetics.ru/catalog/26301/,Крем восстанавливающий / Restoring Cream ALPHA-BETA 50 мл,4510,"Интенсивно восстанавливающий и выравнивающий крем, содержит максимальную концентрацию активных ингредиентов линии. Способствует обновлению эпидермиса.  Выравнивает поверхность и цвет кожи, осветляет пятна.  Растворяет открытые и закрытые комедоны, сокращает поры.  Стимулирует синтез...                             ",4.8,99
www.proficosmetics.ru/catalog/103238/,Крем с гиалуроновой кислотой / PREMIUM IALURON TREATMENT 50 мл,5520,"Легкий крем для кожи, склонной к потере влаги и раннему образованию морщин. Замедлит процессы старения, смягчит кожу и защитит ее от внешних воздействий. Гиалуронат натрия окажет глубокое увлажняющее действие, обеспечит противовоспалительный и регенерирующий эффекты. В результате регулярного...                             ",5.0,2
www.proficosmetics.ru/catalog/3112256/,Крем для век / Eye cream New Age G4 20 мл,8090,"Увлажняющий крем с комфортной текстурой для немедленного и глубокого ухода за нежной кожей вокруг глаз. Повышает гидратацию в эпидермисе и улучшает способность сохранять естественную влагу во всех слоях. Благоприятная для кожи формула с комбинацией церамидов, мощного антиоксидантного и лифтингового...                             ",No rating,No reviews
www.proficosmetics.ru/catalog/70808/,Крем тройного действия вокруг глаз / Triple Action Eye Cream 15 мл,4600,"Крем вокруг глаз тройного действия мужской гаммы средств Men Vita Mineral Declare обладает легкой текстурой и предназначен специально для нежной кожи области вокруг глаз. Крем имеет тройное действие: разглаживает морщины, удаляет темные круги и отечность. Интенсивный быстродействующий крем Triple...                             ",No rating,No reviews
