page_url,drug_name,price,description,rating,num_of_reviews
www.proficosmetics.ru/catalog/136667/,Крем балансирующий для проблемной кожи / Armony Cream 50 мл,3280,"Armony Cream  от Levissime обладает мощным себорегулирующим эффектом. Устраняет и снижает количество различных воспалений и высыпаний на кожных покровах, обладает хорошим поросуживающим действием. При регулярном использовании кожа становится ровной, все участки с дефектами выравниваются и...                             ",4.92,13
www.proficosmetics.ru/catalog/136662/,Крем успокаивающий / Delicate Cream 50 мл,3290,"Крем разработан специально для облегчения состояния раздражённой, покрасневшей или чувствительной кожи. Он образует физиологическую пленку на коже, оберегая ее от действия внешних агрессивных факторов. Обладает выраженным противовоспалительным действием, регулирует водный баланс, стимулирует...                             ",5.0,3
www.proficosmetics.ru/catalog/86112/,Крем Красный клевер 50 мл,1340,"Легкий питательный крем разработан для ухода за чувствительной кожей склонной к куперозу. Экстракты трав комплексно воздействуют на кожу. Красный клевер повышает тонус сосудов. Тимьян уменьшает красноту и успокаивает кожу. Рутин нормализует проницаемость капилляров, что способствует устранению...                             ",4.79,15
www.proficosmetics.ru/catalog/158351/,Крем корректирующий для лица / АзеLine 50 мл,2000,"Эффективное противоугревое средство на основе 20% азелаиновой кислоты. Крем легко впитывается, не оставляя белого налета. Делает лицо матовым, как после нанесения шелковой пудры. Азелаиновая кислота обеспечивает антикомедогенное, антимикробное, противовоспалительное и антиоксидантное действие,...                             ",4.68,25
www.proficosmetics.ru/catalog/136657/,Крем увлажняющий дневной / Aqua Cream 50 мл,3100,"Крем с нежной текстурой и изысканным ароматом содержит ценнейшие ингредиенты, обеспечивающее эффективное наполнение кожи влагой. Препарат идеально подходит для долговременного восстановления водного баланса кожи любого типа, незаменим для сухой и чувствительной. Великолепно защищает кожу от...                             ",5.0,4
www.proficosmetics.ru/catalog/136658/,Крем питательный ночной / Aqua Nutritive 50 мл,3140,"Насыщенный по составу и обладающей приятной текстурой ночной крем обеспечивает интенсивный уход и восстановление сухой и обезвоженной кожи. Содержит высокую концентрацию гиалуроновой кислоты, масел моринги и макадамии, которые встраиваются в роговой слой, способствуют более глубокому проникновению...                             ",5.0,8
www.proficosmetics.ru/catalog/63609/,Крем увлажняющий для лица / SKINCONCELLULAR 50 мл,3285,"Крем улучшает влагоудерживающие свойства кожи, насыщает ее микроэлементами морского происхождения и ценными жирными кислотами, предотвращает фотостарение, нормализует межклеточный энергообмен и восстанавливает здоровую физиологию кожи. После курсового применения кожа становится гладкой, упругой и...                             ",5.0,5
www.proficosmetics.ru/catalog/84179/,Крем гидроактивный / Multi Hydrating Cream 50 мл,4085,"Дневной крем с интенсивным увлажняющим действием для всех типов кожи. Способствует глубокому увлажнению кожи и повышает способность клеток дермы удерживать влагу. За счет этого кожа сохраняет необходимый уровень гидратации в течение всего дня. Крем способствует устранению сухости кожи, а также...                             ",4.79,49
www.proficosmetics.ru/catalog/27478/,Крем регенерирующий ночной / Homework 50 мл,1655,Средство для интенсивного ухода с выраженным регенерирующим действием. Стимулирует обменные процессы в коже. Способствует обновлению клеток кожи. Обладает иммуномодулирующим эффектом. Улучшает эластичность и тургор кожи. Замедляет образование морщин.                             ,4.79,36
www.proficosmetics.ru/catalog/45753/,Крем двойного действия / Dual Action Cream OILY SKIN FORMULA 50 мл,6529,"Крем оказывает как себорегулирующее, так и омолаживающее действие. При нанесении утром придает поверхности кожи приятный атласный вид на целый день, глубоко увлажняет и восстанавливает кожу, снимает покраснения и раздражения. При нанесении вечером нормализует производство себума, насыщает кожу...                             ",5.0,2
www.proficosmetics.ru/catalog/27454/,Крем увлажняющий дневной / Homework 50 мл,1580,"Средство для интенсивного увлажнения кожи, склонной к дегидратации. Обеспечивает выраженный увлажняющий эффект. Оказывает антиоксидантное действие. Устраняет чувство стянутости кожи и шелушение. Защищает от УФ-лучей.                             ",4.85,21
www.proficosmetics.ru/catalog/158390/,Крем солнцезащитный SPF 30 50 мл,1750,"Солнцезащитный крем – для очень светлой и чувствительной кожи, склонной к образованию пигментных пятен. Обеспечивает до 98% защиты от ультрафиолета. Прекрасно впитывается, не оставляет жирной пленки и белого налета, интенсивно питает и увлажняет кожу. Косметические силиконы в составе, способствуют...                             ",4.15,13
www.proficosmetics.ru/catalog/158376/,Крем-лифтинг с био-ДМАЭ 50 мл,3280,"Крем оказывает глубокий и стойкий лифтинг-эффект, улучшает структуру и качество кожи, возвращает ей гладкость, упругость и сияющий вид. Шелковистая основа крема мгновенно впитывается и создает на коже ощущение комфорта. Карнозин разрушает и выводит шлаки и токсины, способствует детоксикации кожи....                             ",No rating,No reviews
www.proficosmetics.ru/catalog/136688/,Крем с экстрактом икры Мультиактив SPF 5 / Multiactiv Cream 50 мл,2520,"Увлажняющий и питательный крем с легчайшей текстурой восстанавливает тонус и подтягивает кожу. Действие препарата основано на уникальном сочетании высокоактивных ингредиентов – экстракта икры и гиалуроновой кислоты, которые глубоко обновляют кожу и способствуют насыщению её кислородом....                             ",5.0,4
www.proficosmetics.ru/catalog/53079/,Крем мультивитаминный Гидро С / LE PRESTIGE 50 мл,4955,"Крем «ГИДРО С» предназначен для нормальной и сухой кожи, имеет насыщенную, но в то же время неплотную комфортную текстуру. Высокоактивный комплекс из витаминов А, Е, С и группы В способствует глубокому увлажнению, смягчению и восстановлению кожи. Витамин С, проникая в глубокие слои кожи,...                             ",5.0,26
www.proficosmetics.ru/catalog/116527/,Крем Anti Acne 50 мл,1610,"Легкий крем обеспечивает полноценный уход за жирной/проблемной кожей. Изофлавоны сои оказывают себорегулирующее действие. Экстракт эхинацеи сохраняет водный баланс кожи. Азелаиновая кислота предупреждает и уменьшает количество воспаленных элементов. Активные ингредиенты: альпосомы, содержащие масла...                             ",4.56,21
www.proficosmetics.ru/catalog/3044165/,Крем дневной омолаживающий для лица / DAY CREAM 50 мл,8100,"Формула предназначена для интенсивного воздействия на морщины, темные пятна, потерю эластичности и тонуса кожи. Интенсивное действие омолаживающего крема для лица основано на сочетании Sibanid SG, стволовых клеток ботанического происхождения и Ellagic Acid.                             ",No rating,No reviews
www.proficosmetics.ru/catalog/117486/,Крем с экстрактом гнезда ласточки для области глаз / Swallow Homework 30 мл,1410,"Средство коррекции увядания кожи области глаз. Благодаря содержанию в экстракте гнезда ласточки муцина и белков «эпидермального роста» удерживает влагу, оберегает кожу от гравитационного провисания. Содержит уникальный комплекс ферментированного масла семян винограда и масла Цубаки. Способствует...                             ",4.87,15
www.proficosmetics.ru/catalog/158367/,Крем для коррекции глубоких морщин Ботулонг 50 мл,3600,"Крем специально разработан для коррекции глубоких морщин. Действуя на клеточном уровне, крем структурно восстанавливает кожу, а также способен замедлять проводимость нервного импульса, мягко расслабляя мышцу. Входящие в состав крема активные компоненты оказывают лифтинговый эффект, улучшают овал...                             ",No rating,No reviews
www.proficosmetics.ru/catalog/134301/,Крем омолаживающий для лица / ANTI WRINKLES CREAM 200 мл,2770,"Крем для лица ANTI WRINKLES CREAM работает на коррекцию возрастных изменений и обладает ярко выраженным омолаживающим эффектом: повышает эластичность и упругость кожи, улучшает ее структуру, уменьшает выраженность морщин, устраняет следы усталости. Защищает кожу от потери влаги и восстанавливает...                             ",5.0,1
www.proficosmetics.ru/catalog/84178/,Крем экстра увлажняющий / Extra Moisturizing Cream 50 мл,3815,"Крем, обладающий мощным увлажняющим действием. Предназначен для очень сухой, обезвоженной кожи. Средство, содержащее несколько разномолекулярных видов гиалуроновой кислоты, проникает в глубинные слои кожи и способствует удержанию там влаги. Усиливает естественную способность кожи сохранять воду в...                             ",4.74,22
www.proficosmetics.ru/catalog/50892/,Крем нежный вокруг глаз Гринс / Tender Eye Contour Cream GREENS 30 мл,4765,"Специальный крем для ухода за нежной кожей вокруг глаз на основе зеленых ростков пшеницы и ростков гречихи. Имеет нежную консистенцию и максимально обогащенную основу. Олигопептид (Myoxinol), извлеченный из протеинов семян Гибискуса и Ацетил гексапептид-3 (Аргирелин) уменьшают морщины, являясь...                             ",5.0,4
www.proficosmetics.ru/catalog/350880/,Крем-флюид для лица Микроретинол / A CLASSIC 30 мл,5695,"Изысканный крем необычайно нежной текстуры с тонким ароматом ванили предназначен для домашнего ухода за кожей лица после 30 лет. Входящий в состав ретинол заключен в микрокапсулы, что обеспечивает его высвобождение на необходимом уровне кожи с целью оптимального воздействия. Крем подходит для...                             ",No rating,No reviews
www.proficosmetics.ru/catalog/84232/,Крем-лифтинг / Lifting Cream 50 мл,4410,"Укрепляющий освежающий крем для лица и шеи для всех типов кожи. Крем усиливает естественные защитные механизмы кожи, стимулирует процессы клеточного восстановления. Придает коже упругость, подтянутость и молодость. PHYTODERMINA LIFTING™ - биотехнологический компонент растительного происхождения....                             ",5.0,11
www.proficosmetics.ru/catalog/1515502/,Крем увлажняющий и восстанавливающий / Naturals Cream 50 мл,2620,"Увлажняющий и восстанавливающий крем, создан из ингредиентов натурального происхождения, моментально впитывается, благодаря легкой текстуре. Обладает мощным антиоксидантным эффектом за счет экстракта ундарии перистой и экстракта вербены, улучшает состояние эпидермиса, тонизирует, возвращает коже...                             ",5.0,3
www.proficosmetics.ru/catalog/113924/,Крем солнцезащитный для гиперчувствительной кожи SPF 50 / BIOGENA TAE-X ROSE 60 мл,4248,"Максимальная защита кожи при куперозе и розацеа. Эксклюзивная система фильтров полностью экранирует UVA, UVB, наиболее опасные для поверхностных капилляров. Благодаря активному действию натурального лютеина блокируется и синяя часть спектра. TAE-X Rose содержит феруловую кислоту и витамин Е. Эти...                             ",No rating,No reviews
www.proficosmetics.ru/catalog/3068545/,Крем SPF 35 / Solar Expert 50 мл,1330,"Солнцезащитный крем-эмульсия для активной защиты от ультрафиолета спектра UVA/ UVB/ IR. Отличный выбор для чувствительной, склонной к куперозу кожи. Что делает: экстракт барбариса оказывает противовоспалительное, успокаивающее действие, корректирует пигментацию. диоксид титана — эффективный...                             ",No rating,No reviews
www.proficosmetics.ru/catalog/3055283/,"Крем укрепляющий с коэнзимами Q10, гиалуроновой кислотой и коллагеном / TENSOR Q10 COLLAGEN 50 мл",3120,"Крем с высоким содержанием гидролизированного коллагена, коэнзима Q10 и гиалуроновой кислоты; препарат для комплексной коррекции возрастных изменений кожи и антиоксидантной защиты в любом возрасте. Тройное сочетание активных компонентов позволяет заметно уменьшить морщины, стимулирует выработку...                             ",5.0,1
www.proficosmetics.ru/catalog/30767/,Крем увлажняющий для жирной и проблемной кожи / Moisturizer LIPACID 100 мл,3970,"Мягкий крем на легкой нежирной основе. Идеально подходит под макияж. Обладает выраженным противовоспалительным, антибактериальным и кератолитическим действием, способствует заживлению мелких ранок и трещин, уменьшает сальность кожи. Активизирует обменные процессы в коже и нормализует водно-липидный...                             ",4.86,33
www.proficosmetics.ru/catalog/3022014/,Крем восстанавливающий для лица / RESTORER 50 мл ,2130,"Восстановление после травмирующих процедур и уход за кожей с атопическим дерматитом. Восстанавливающий крем на основе ламеллярной эмульсии. Усиливает регенерацию, восстанавливает барьерные и иммунные свойства кожи. Длительно поддерживает необходимый уровень влажности. Оказывает...                             ",4.25,4
www.proficosmetics.ru/catalog/2314638/,Крем ночной успокаивающий для лица / Homework 50 мл,1525,"Крем ночной успокаивающий для лица Homework эффективно снимает гиперемию, красноту, шелушение кожи, что делает нежно голубую эмульсию незаменимой при гиперчувствительной коже. Обладает противовоспалительным действием. Нормализует деятельность сальных желез. Оказывает профилактику сальных пробок....                             ",5.0,4
www.proficosmetics.ru/catalog/58994/,Крем фотозащитный для жирной кожи SPF 35 / Oily Skin Sunguard 50 мл,1520,"Легкая эмульсия учитывает особенности жирной кожи:   обладает себостатическим и противовоспалительным действиями;  некомедогенна, не оставляет жирной пленки;   сохраняет матовость кожи в течение 6 часов;   обладает антиоксидантным действием;   предохраняет от ожогов и...                             ",4.6,12
www.proficosmetics.ru/catalog/3115984/,Крем для лица / Bio Hyalurone 50 мл,1290,"Крем-антиоксидант на основе гиалуроновой кислоты для эффективного увлажнения в течение всего дня. Идеален для ухода за обезвоженной чувствительной кожей. Алоэ барбадосское стимулирует обменные процессы, тонизирует и увлажняет кожу. Гиалуроновая кислота создает на коже невидимый барьер,...                             ",5.0,1
www.proficosmetics.ru/catalog/53064/,Крем для глазного контура / Premium cellular shock 30 мл,4940,"Крем для век специально создан для глубокого увлажнения и питания очень сухой и тонкой кожи вокруг глаз. Средство является активным профилактическим средством для борьбы с морщинами и отёками под глазами. Матриксил оказывает выраженный лифтинговый эффект, стимулируя выработку коллагена,...                             ",5.0,8
www.proficosmetics.ru/catalog/50847/,Крем Барбадос / Delicate Oily Skin Balm BARBADOS 70 мл,2715,"Легкий крем для чувствительной проблемной кожи. Крем на основе натурального сока алоэ, предназначенный для жирной и себорейной кожи, разработан в конце 70-х годов, принес мировую известность лаборатории Anna Lotan. Формула запатентована. Крем представляет собой легкую эмульсию типа «масло в воде» с...                             ",4.72,31
www.proficosmetics.ru/catalog/3090962/,Крем-овал липосомальный Амарант 50 мл,1290,Питательный крем для коррекции овала лица. Безупречен для активного восстановления и омоложения. Назначение: Корректирует овал лица Лифтинг-эффект Повышает плотность кожи Разглаживает морщины Увлажняет кожу Улучшает цвет лица Что делает: биоактивный гиалурон проникает вглубь эпидермиса и...                             ,4.64,11
