page_url,drug_name,price,description,rating,num_of_reviews
www.proficosmetics.ru/catalog/87411/,Крем матирующий для жирной кожи / BIOGENA OILY SKIN 50 мл,4167,"Увлажняющий и очищающий кожу крем легкой текстуры. Идеально впитывается. Устраняет воспаления и предотвращает появление повторных высыпаний. С помощью фарнезола и экстрактов серенои и репейника убирает избыточный блеск жирной кожи, сужает расширенные поры. Результат: матовая кожа без воспалений ....                             ",No rating,No reviews
www.proficosmetics.ru/catalog/130448/,Крем Bio Phloretin 50 мл,1780,"Крем для активного омоложения и обеспечения высокого уровня защиты ДНК кожи. Флоретин стимулирует активность кожи, повышает эффективность и ускоряет регенерацию после инвазивных процедур. Эфирное масло лиметта восстанавливает капилляры и поврежденные клетки. Изофлавоны сои стимулируют синтез...                             ",5.0,1
www.proficosmetics.ru/catalog/50772/,Крем дневной Золотой / Golden Day Cream LIQUID GOLD 60 мл,2490,"Деликатный, легкий дневной крем, не содержащий традиционных поверхностно-активных веществ, эффективно предотвращает сухость кожи. Является идеальной основой под макияж. Хорошо смягчает, увлажняет, освежает и питает тонкую, сухую кожу, придает ей шелковистость и эластичность. Быстро впитывается и не...                             ",4.62,13
www.proficosmetics.ru/catalog/43352/,Крем с лифтинг эффектом на основе морских водорослей / ALGAMAR 50 мл,5965,"Благодаря эксклюзивной формуле, лежащей в основе, крем Тегор насыщает живительной влагой самые глубокие слои кожи, активизируя процесс клеточного обновления и моментально разглаживая мелкие морщинки и складки. Крем Tegor подарит вам возможность совершить увлекательное путешествие в таинственный мир...                             ",No rating,No reviews
www.proficosmetics.ru/catalog/105733/,Крем-коктейль гиалуроновый / Homework 50 мл,1745,"Средство комплексной коррекции возрастных изменений лица и шеи. Выражено улучшает эластические свойства кожи, способствует уменьшению ширины и глубины морщин. Обеспечивает каскадное увлажнение в течение 24 часов. Коктейль из низко- и высокомолекулярной гиалуроновой кислоты делает препарат...                             ",4.55,11
www.proficosmetics.ru/catalog/784262/,Крем ночной для лица / ACNON Overnight treatment 50 мл,2792,"Крем ночной для лица ACNON Overnight treatment. Действие ночного крема направлено на восстановление нормальной работы сальных желез, предотвращение закупорки пор, борьбу с воспалением и увлажнение обезвоженной кожи. В состав входят такие компоненты, как витамин...                             ",4.83,18
www.proficosmetics.ru/catalog/158370/,"Крем для век, специальный уход 15мл",2240,"Крем создан для коррекции возрастных изменений и устранения застойных явлений в области век. Питает кожу, повышает ее тонус и эластичность. Разглаживает морщины, уменьшает отечность и способствует осветлению темных кругов под глазами. Пептидный комплекс нормализует процессы клеточного дыхания,...                             ",2.0,1
www.proficosmetics.ru/catalog/27589/,Крем-лифтинг день-ночь / X-TREME 50 мл,7335,"Высокоактивный крем для быстрого восстановления упругости кожи. Основное действующее вещество – высокотехнологичный компонент liposomal® в микрокапсулах – осуществляет эндодермальное воздействие, восстанавливая коллагеновые и эластиновые волокна. Шёлковые протеины создают дополнительную защитную...                             ",No rating,No reviews
www.proficosmetics.ru/catalog/88337/,Крем-маска ночная с секретом улитки / Secret Mask Homework 50 мл,1830,"Секретный ночной крем обладает выраженным лифтинговым и регенерирующим эффектом, содержит высокий процент экстракта секрета улитки и anti-age формулу Xpertmoist. Композиция масел ши и ореха обогащает кожу ненасыщенными жирными кислотами. С использованием этого крема утро приятно удивит вас...                             ",4.86,8
www.proficosmetics.ru/catalog/106338/,Крем SPF 50 50 мл,1642,"Для всех типов кожи, особенно для кожи, склонной к появлению пигментных пятен. Незаменимое средство в борьбе за красивый и безопасный загар. Обеспечивает рост выживаемости клеток кожи при UVB облучении, замедляя старение при стресс‐воздействии, является выраженным антиоксидантом, активирует синтез...                             ",4.83,7
www.proficosmetics.ru/catalog/158375/,Крем увлажняющий дневной SPF 10 50 мл,1550,"Дневной увлажняющий крем с защитой от UVB- и UVA-излучения. Идеально подходит для ежедневного применения благодаря сбалансированной концентрации SPF-фильтров. Обеспечивает профилактику гиперпигментации и фотостарения. Масло ши и мембранные липиды эффективно увлажняют кожу, поддерживают её барьерные...                             ",4.83,7
www.proficosmetics.ru/catalog/63602/,Крем для лица Гиалуроник день-ночь / HYALURONIC 50 мл,7665,"Крем для комплексного ухода за кожей лица, шеи и декольте утром и вечером. Средство имеет инновационную крем-гелевую текстуру, легко впитывается и оказывает общеоздоровительное воздействие на кожу: глубокое увлажнение, детоксикация, устранение покраснений и восстановление целостности эпидермиса,...                             ",5.0,2
www.proficosmetics.ru/catalog/50896/,Крем ночной Гринс / Replenishing Balm GREENS 50 мл,4765,"Активный крем-эксфолиант с миорелаксантами и интенсивным действием на процессы обновления клеток эпидермиса. Содержит (MNF) Натуральный Увлажняющий Фактор, сок Алоэ, который дополнительно увлажняет и сводит к минимуму любое раздражение кожи. Зеленые ростки пшеницы и ростки гречихи привносят в...                             ",5.0,1
www.proficosmetics.ru/catalog/3115972/,Крем интенсивного омоложения для лица / Bio Lift 50 мл,1570,"Питательный крем на основе пептидов для интенсивного омоложения. Эффективен для быстрого восстановления упругости кожи. Экстракт ламинарии активирует внутриклеточные процессы, насыщая клетки кислородом. Масло макадамии смягчает, питает и устраняет сухость. Ацетил гексапептид-8 (аргирелин) - мощный...                             ",No rating,No reviews
www.proficosmetics.ru/catalog/27694/,Крем-уход 24 часа для лица / BETA GLUCAN 50 мл,4710,"Легкий крем, разработанный специально для аллергиков, удобен и гигиеничен в использовании за счет флакона с помповым дозатором. В-глюкан успокаивает раздражение, поддерживает защитные силы кожи. Пантенол и сквален восстанавливают и защищают кожу. Масла макадамии и миндаля питают и смягчают....                             ",No rating,No reviews
www.proficosmetics.ru/catalog/40637/,Крем для кожи вокруг глаз / C PURE 15 мл,3725,"Легкий крем насыщает кожу витаминами и питательными веществами, увлажняет и предотвращает процессы старения, устраняет отечность, осветляет и выравнивает общий оттенок кожи. В результате применения крема кожа век становится гладкой и упругой. Для нормальной и сухой кожи век.                             ",No rating,No reviews
www.proficosmetics.ru/catalog/3093527/,Очищающая крем-пенка / CLEAN&ACTIVE Cleansing Cream Foam 100 мл,4600,"Кремовая текстура при контакте с водой средство превращается в лёгкую воздушную пену, делая процесс очищения невероятно комфортным.                             ",No rating,No reviews
www.proficosmetics.ru/catalog/84189/,Крем на основе икры с омега 3 / Caviar Ω3-Ω6 Cream 50 мл,5400,"Крем для лица с икрой, обогащенный жирными кислотами Омега-3, Омега-6 для зрелой, уставшей и тусклой кожи. Питает, стимулирует и улучшает внешний вид кожи, устраняет признаки морщин и усталости. Одновременно он укрепляет эластичность и текстуру кожи, придавая ей сияние и свежесть. Крем из черной и...                             ",5.0,3
www.proficosmetics.ru/catalog/29925/,Комплекс радикально увлажнящий для лица / IMMUN 50 мл,3505,"Ультралегкая крем-гелевая консистенция средства позволяет применять комплекс для любой кожи, в том числе жирной и чувствительной. Обладает мгновенным увлажняющим эффектом. Биосостав последнего поколения усиливает систему самозащиты раздраженной кожи, предотвращая процесс преждевременного старения,...                             ",No rating,No reviews
www.proficosmetics.ru/catalog/142142/,Крем на основе икры с омега 3 и омега 6 для век 20 мл,4250,"Крем с икрой, обогащенный жирными кислотами Омега-3 и Омега-6, предназначен специально для области вокруг глаз. Увлажняет, стимулирует и улучшает состояние кожи, уменьшает морщины, придает упругость и сияние. Крем с черной и красной икрой, богатый жирными кислотами омега-3 и омега-6, витаминами,...                             ",4.92,15
www.proficosmetics.ru/catalog/830070/,Крем-лифтинг для лица / Super Gold 80 мл,2403,"Лифтинг-крем Super Gold оказывает стойкий лифтинг-эффект, наполняет кожу энергией, стимулирует процессы клеточного обновления. Повышает упругость и плотность кожи, эффективно борется с морщинами, поддерживает необходимый уровень увлажнения, придает коже мягкость и эластичность. Для любого типа кожи.                             ",5.0,5
www.proficosmetics.ru/catalog/3061657/,Крем ночной с 10% гликолевой кислотой для всех типов кожи / 10% Glycolic Cream NUTRI-PEPTIDE 50 мл,4245,"Крем ночной с 10% гликолевой кислотой для всех типов кожи с эффектом пилинга для домашнего ухода. Мягко отшелушивает, интенсивно обновляет и улучшает текстуру кожи. Гликолевая кислота устраняет гиперкератоз и вместе с растительными экстрактами обеспечивает...                             ",4.83,6
www.proficosmetics.ru/catalog/142152/,Крем для коррекции морщин 40+ Хронос 50 мл,6120,"Высокоэффективный крем для полного обновления, подходящий для зрелой кожи. Он разглаживает признаки старения, обеспечивая увлажнение, сияние, упругость и жизненную силу для омоложения уставшей кожи. Усовершенствованный с помощью технологии “Косметических дронов”, он предлагает передовую и...                             ",4.83,6
www.proficosmetics.ru/catalog/159540/,Крем интенсивно увлажняющий для лица с мочевиной 10% / Intensive Moisture 150 мл,556,"Лёгкий, быстро впитывающийся крем с мочевиной (urea 10%). Предназначен для сухой кожи, склонной к появлению шелушений. Крем мгновенно увлажняет кожу, повышает её барьерные свойства, способствует снижению трансэпидермальной потери влаги. Рекомендуется при водном дисбалансе, сильном шелушении,...                             ",4.8,49
www.proficosmetics.ru/catalog/84187/,Крем ретин С / Retinoid C Cream 50 мл,4465,"Крем Ретиноид Retinoid C Cream для эффективной профилактики и коррекции возрастных изменений и фотостарения. Восстанавливающий, антиоксидантный крем для лица для всех типов кожи. Крем, который сочетает в себе восстанавливающий эффект ретиноида и витамина С против дефектов кожи, повреждений и...                             ",5.0,4
www.proficosmetics.ru/catalog/50791/,Крем ночной Золотой / Golden Night Cream LIQUID GOLD 50 мл,3765,"Бархатистый ночной крем для увядающей сухой кожи, содержащий натуральные воски, растительные стеролы, масло облепихи, жожоба и витамин Е. Насыщает кожу питательными веществами и влагой. Смягчает и разглаживает морщины, придает коже свежий, отдохнувший вид. Защищает её от вредного воздействия...                             ",4.86,7
www.proficosmetics.ru/catalog/158369/,"Крем для век, поддерживающий уход 15мл",1750,"Крем предназначен для ухода за нежной и чувствительной кожей век. Увлажняет, питает кожу, нормализует клеточное дыхание и обменные процессы, сохраняет упругость и эластичность кожи век, существенно отдаляя первые признаки старения. Экстракт конского каштана и гесперидин укрепляют стенки капилляров,...                             ",4.25,4
www.proficosmetics.ru/catalog/27341/,Крем для век / Eye Zone Cream VITAMIN E 50 мл,3525,"Питательный и укрепляющий крем в виде легкой эмульсии легко и быстро усваивается нежной и тонкой кожей век. Витамин Е содержится в высокой концентрации в микрокапсулах, в связи с чем приникает глубоко в эпидермис и, постепенно высвобождаясь,...                             ",4.97,32
www.proficosmetics.ru/catalog/53081/,Крем ночной / Premium cellular shock 50 мл,6590,"Активный лифтинговый крем для сухой, нормальной и комбинированной кожи с выраженными возрастными изменениями. Матриксил, входящий в состав средств, является стимулятором упругости кожи, активирует фибробласты, инициируя синтез коллагенов 1-го, 4-го, 7-го типов, а также гликозаминогликанов и белка...                             ",5.0,4
www.proficosmetics.ru/catalog/127507/,Крем-гель с охлаждающим эффектом / Anti-acne Homework 50 мл,1015,"Средство ухода за жирной кожей в дневное время для коррекции и профилактики акне. Крем-гель снимает воспаление, способствует сужению пор, рассасыванию застойных пятен, снижает уровень и темп секреции кожного сала. Устраняет покраснения, сальные пробки, матирует кожу. Оказывает выраженное...                             ",4.75,8
www.proficosmetics.ru/catalog/3091215/,"Крем антивозрастной для кожи с куперзом / Biogena Save Rose Kion SPF10, 50 мл",5521,"Save Rose Kion — это крем для чувствительной, покрасневшей или склонной к покраснению кожи, а также кожи с расширенными капиллярами. Он представляет собой идеальное вспомогательное средство для борьбы с куперозом. Моментально уменьшает заметность покраснения,...                             ",No rating,No reviews
www.proficosmetics.ru/catalog/84188/,Крем питательный / Nourishing Cream 50 мл,3960,"Насыщенный питательный крем для сухой, нормальной и зрелой кожи. Питает, восстанавливает, уменьшает проявление морщин и признаков усталости, придавая коже свежесть и жизненную силу. Крем богат витаминами А, Е и ретинолом. Содержит отдельные красные микросферы витамина Е и микросферы ретинола,...                             ",4.85,21
www.proficosmetics.ru/catalog/55945/,Крем увлажняющий дневной Себорегулятор 50 мл,1503,"Увлажняющий дневной крем, предназначенный для проблемной кожи, склонной к жирности. Крем обеспечивает глубокую гидратацию обезвоженной кожи, надолго устраняя сухость. Предотвращает шелушение кожи устраняет ощущение огрубелости и стянутости кожи. Крем способствует удержанию влаги в клетках кожи,...                             ",4.36,14
www.proficosmetics.ru/catalog/3105556/,Крем ребалансирующий 50 мл,5560,"Легкий, нежный крем для нормальной, комбинированной и жирной кожи восстанавливает и обеспечивает комфорт 24 часа. Входящий в состав пребиотик – альфа-глюкан олигосахарид помогает поддерживать естественную микрофлору кожи, укрепляет защитные механизмы, снижает чувствительность и успокаивает. AHA...                             ",5.0,2
www.proficosmetics.ru/catalog/84257/,Крем для проблемной кожи / Clarifying Active Cream 50 мл,3240,"Интенсивный крем, специально разработанный для проблемной кожи с акне. Уменьшает проявления симптомов акне и поглощает излишки кожного сала, улучшая внешний вид кожи, не вызывая сухости и раздражения. Специализированный крем, содержащий канадский иван-чай, ингредиент, который подавляет действие...                             ",4.67,19
www.proficosmetics.ru/catalog/104006/,Крем контурный для век / Eye Contour Cream NUTRI-PEPTIDE 20 мл,3930,"Высокоактивный крем для ухода за деликатной областью вокруг глаз. Содержит уникальный комплекс капсул с экстрактом водорослей и пептидом, стимулирующий выработку жизненно важной энергии, необходимой для регенерации коллагеновых волокон. Кроме того, крем содержит уникальный комплекс...                             ",4.27,12
www.proficosmetics.ru/catalog/57347/,Крем увлажняющий и успокаивающий / Flogan Krem BIOGENA 50 мл,5521,"Крем для лица, предназначенный для смягчения, увлажнения и защиты раздраженной или чувствительной кожи, имеющей тенденцию к себорее. При ежедневном использовании FLOGAN KREM способствует предупреждению неэстетичных покраснений кожи, неприятного поверхностного шелушения и зуда, в том числе сильного....                             ",5.0,1
